[
  {
    "code": "SD",
    "label": "Posve netočno",
    "value": 1,
    "option_order": 1
  },
  {
    "code": "D",
    "label": "Uglavnom netočno",
    "value": 2,
    "option_order": 2
  },
  {
    "code": "N",
    "label": "Ni točno ni netočno",
    "value": 3,
    "option_order": 3
  },
  {
    "code": "A",
    "label": "Uglavnom točno",
    "value": 4,
    "option_order": 4
  },
  {
    "code": "SA",
    "label": "Posve točno",
    "value": 5,
    "option_order": 5
  }
]
